<?xml version="1.0"?>
<!DOCTYPE vortaro SYSTEM "../dtd/vokoxml.dtd">

<vortaro>
<art mrk="$Id: mizoram.xml,v 1.1 2014/09/17 01:11:02 revo Exp $">
<kap>
  <rad>Mizoram</rad>/o <fnt><bib>LanLin</bib></fnt>
</kap>
<drv mrk="mizoram.0o">
  <kap><tld/>o</kap>
  <snc mrk="mizoram.0o.GEOG">
    <uzo tip="fak">GEOG</uzo>
    <dif>
      Gubernio en la orienta parto de
      <ref tip="malprt" cel="hind.H0ujo.POL">Hindujo</ref>:
      <ekz>
        en <klr>...</klr> <tld/>o en Barato, 
        &ccirc;akma-parolantaj infanoj havas instruistojn kiuj apartenas al 
        la plimulta etnogrupo Mizoj
        <fnt>
          <aut>A. Giridhar Rao</aut>,
          <vrk><url ref="http://www.ipernity.com/blog/giridhar/159540">
          Lingva diskriminacio en Mizoramo</url></vrk>,
          <lok>2009-06-15</lok>
        </fnt>.
      </ekz>
    </dif>
  </snc>
  <trd lng="fr">Mizoram</trd>
</drv>
</art>

<!--
$Log: mizoram.xml,v $
Revision 1.1  2014/09/17 01:11:02  revo
Jeromo Vasxe: nova artikolo

-->
</vortaro>