<?xml version="1.0"?>
<!DOCTYPE vortaro SYSTEM "../dtd/vokoxml.dtd">

<vortaro>
<art mrk="$Id: garden.xml,v 1.23 2015/09/21 11:10:15 revo Exp $">
<kap>
  <ofc>1</ofc>
  <rad>gardeni</rad>/o <fnt><bib>PV</bib></fnt>
</kap>
<drv mrk="garden.0o">
  <kap><tld/>o</kap>
  <snc mrk="garden.0o.BOT">
    <uzo tip="fak">BOT</uzo>
    <dif>
      &Ccirc;iamverda arbeto el malsekaj tropikaj regionoj kun belaj 
      dikpetalaj floroj kaj brilaj malhelverdaj folioj,
      <ref tip="lst" cel="genr.0o.BIO"
      lst="voko:botanikaj_genroj">genro</ref> el familio <ref
      tip="malprt"
      cel="rubi.0oj.BOT">rubiacoj</ref>
      (<trd lng="la">Gardenia</trd>):
      <ekz>
        la italo alvenis nokti&gcirc;e kun <tld/>o en la butontruo de la 
        jakfaldo
        <fnt><aut>G. Garc&iacute;a M&aacute;rquez, trad. F. de Diego</aut>, <vrk>Cent 
        Jaroj da Soleco</vrk>, <lok>Fonto, 1992</lok></fnt>;
      </ekz>
      <ekz>
        li! Alfredo, en blanka kompleto, kun ru&gcirc;a kravato kaj du 
        <tld/>oj enmane!
        <fnt>
          <aut>M. Fern&aacute;ndez</aut>,
          <vrk>Du Gardenioj</vrk>,
          <lok>Ekstremoj, 1997</lok>
        </fnt>.
      </ekz>
    </dif>
  </snc>
  <trd lng="en">gardenia</trd>
  <trd lng="be">&c_g;&c_a;&c_r;&c_d;&c_e;&c_n;&c_ib;&c_ja;</trd>
  <trd lng="ca">gard&egrave;nia</trd>
  <trd lng="cs">gard&eacute;nie</trd>
  <trd lng="de">Gardenie</trd>
  <trd lng="el">&gamma;&alfa;&rho;&delta;&epsilon_ton;&ny;&jota;&alfa;</trd>
  <trd lng="es">gardenia</trd>
  <trd lng="fr">gard&eacute;nia</trd>
  <trd lng="hu">gard&eacute;nia</trd>
  <trd lng="it">gardenia</trd>
  <trd lng="nl">gardeniastruik</trd>
  <trd lng="pl">gardenia</trd>
  <trd lng="pt">gard&ecirc;nia</trd>
  <trd lng="ru">&c_g;&c_a;&c_r;&c_d;&c_je;&c_n;&c_i;&c_ja;</trd>
  <trd lng="sk">gard&eacute;nia</trd>
</drv>
</art>
<!--
$Log: garden.xml,v $
Revision 1.23  2015/09/21 11:10:15  revo
Sebastian Cyprych: +trd pl

Revision 1.22  2015/09/14 14:10:18  revo
Cindy Moon McKee: +trd en

Revision 1.21  2015/07/04 08:37:34  revo
aldono de trd cs per skripto de M. von Laer

Revision 1.20  2015/06/29 16:29:39  revo
aldono de trd sk per skripto de M. von Laer

Revision 1.19  2013/08/29 09:10:20  revo
Wolfram Diestel: referenco al listo bot genroj

Revision 1.18  2012/08/04 19:10:16  revo
Marc Rausell: + trd ca

Revision 1.17  2010/08/09 16:30:19  revo
Jeromo Vasxe: kor. 1 ekz

Revision 1.16  2007/05/03 16:51:45  revo
-->
</vortaro>
