<?xml version="1.0"?>
<!DOCTYPE vortaro SYSTEM "../dtd/vokoxml.dtd">

<vortaro>
<art mrk="$Id: preben.xml,v 1.14 2015/07/04 08:37:41 revo Exp $">
<kap>
  <rad>prebend</rad>/o
  <fnt>Z</fnt>
</kap>
<drv mrk="preben.0o">
  <kap><tld/>o</kap>
  <uzo tip="fak">KAT</uzo>
  <snc>
    <dif>
      Rento alligita al eklezia titolo.
    </dif>
  </snc>
  <trd lng="be">&c_p;&c_r;&c_e;&c_b;&c_e;&c_n;&c_d;&c_a;</trd>
  <trdgrp lng="cs">
    <trd>obročí</trd>,
    <trd>prebenda</trd>
  </trdgrp>
  <trd lng="de">Pr&auml;bende</trd>
  <trd lng="en">prebend</trd>
  <trdgrp lng="hu">
    <trd>praebenda</trd>,
    <trd>egyh&aacute;zi <ind>javadalom</ind></trd>
  </trdgrp>
  <trd lng="it">prebenda</trd>
  <trdgrp lng="nl">
    <trd>prebende</trd>,
    <trd>kerkelijk <ind>rente</ind></trd>
  </trdgrp>
  <trd lng="pl">prebenda</trd>
  <trd lng="pt">prebenda</trd>
  <trd lng="ru">&c_p;&c_r;&c_je;&c_b;&c_je;&c_n;&c_d;&c_a;</trd>
  <trdgrp lng="sk">
    <trd>benefícium</trd>,
    <trd>obročie</trd>,
    <trd>prebenda</trd>
  </trdgrp>
</drv>
</art>
<!--
$Log: preben.xml,v $
Revision 1.14  2015/07/04 08:37:41  revo
aldono de trd cs per skripto de M. von Laer

Revision 1.13  2015/06/29 16:40:18  revo
aldono de trd sk per skripto de M. von Laer

Revision 1.12  2010/11/04 17:31:09  revo
Antonio Codazzi: +trd it

Revision 1.11  2009/06/09 16:31:40  revo
Russ Williams: +trd en

Revision 1.10  2008/05/20 16:30:41  revo
Sebastian Cyprych: +trd pl

Revision 1.9  2006/03/17 17:32:20  revo
Tulio Flores: +tr pt

Revision 1.8  2005/01/15 17:32:28  revo
Dmitri Gabinski: +trd be

Revision 1.7  2002/08/05 17:31:42  revo
Jozefo Horvath: +trd hu

Revision 1.6  2001/12/24 19:29:23  revo
Yury Finkel: +trd ru

Revision 1.5 2001/07/01 18:12:22 revo
-->
</vortaro>
