<?xml version="1.0"?>
<!DOCTYPE vortaro SYSTEM "../dtd/vokoxml.dtd">

<vortaro>
<art mrk="$Id: sabek.xml,v 1.17 2015/11/26 15:10:21 revo Exp $">
<kap>
  <rad>sabek</rad>/o <fnt><bib>PV</bib></fnt>
</kap>
<drv mrk="sabek.0o">
  <kap><tld/>o</kap>
  <snc mrk="sabek.0o.MUZ">
    <uzo tip="fak">MUZ</uzo>
    <dif>
      Antikva hebrea
      <ref tip="lst" cel="instru2.kord0o.MUZ"
      lst="voko:kordinstrumentoj">kordinstrumento</ref>
      triangula:
      <ekz>
        &ccirc;iuj popoloj eka&ubreve;dis la sonon de korno, fluto, harpo, <tld/>o,
        psaltero, kaj diversaj muzikaj instrumentoj
        <fnt><bib>MT</bib>, <lok>&Dan; 3:7</lok></fnt>.
      </ekz>
    </dif>
  </snc>
  <trd lng="cs">sabek</trd>
  <trd lng="de">Sambuka</trd>
  <trd lng="en">sabeca</trd>
  <trd lng="fr">sambuque</trd>
  <trd lng="hu">sambuca <klr>(h&aacute;romsz&ouml;g alak&uacute; h&aacute;rfa)</klr></trd>
  <trd lng="it">sambuca</trd>
  <trd lng="nl">sabbeca</trd>
  <trdgrp lng="pt">
   <trd>sabeca</trd>
  </trdgrp>
  <trdgrp lng="ru">
    <trd>&c_s;&c_a;&c_m;&c_b;&c_u;&c_k;</trd>,
    <trd>&c_s;&c_a;&c_m;&c_b;&c_u;&c_k;&c_a;</trd>
  </trdgrp>
  <trd lng="sk">sabek</trd>
</drv>
</art>
<!--
$Log: sabek.xml,v $
Revision 1.17  2015/11/26 15:10:21  revo
Cindy Moon McKee: +trd en

Revision 1.16  2015/07/04 08:37:43  revo
aldono de trd cs per skripto de M. von Laer

Revision 1.15  2015/06/29 16:33:22  revo
aldono de trd sk per skripto de M. von Laer

Revision 1.14  2013/09/08 18:11:36  revo
Wolfram Diestel: ref al listo kordinstrumentoj

Revision 1.13  2011/01/06 15:25:15  revo
Jeromo Vasxe: kor. 1 fusxitan fnt

Revision 1.12  2009/09/19 16:30:55  revo
Antonio Codazzi: +trd it

Revision 1.11  2006/02/06 17:31:26  revo
Tulio Flores: +trd pt

Revision 1.10  2005/08/17 16:31:31  revo
-->
</vortaro>
