<?xml version="1.0"?>
<!DOCTYPE vortaro SYSTEM "../dtd/vokoxml.dtd">

<vortaro>
<art mrk="$Id: vincxestr.xml,v 1.3 2012/08/13 10:10:21 revo Exp $">
<kap>
  <rad>vin&ccirc;estr</rad>/o
</kap>
<drv mrk="vincxestr.0o">
  <kap><tld/>o</kap>
  <snc mrk="vincxestr.0o.ARM">
    <dif>
      Pafilo el la samnoma kompanio, precipe <ref tip="super" 
      cel="karabe.0o.ARM">karabeno</ref> produktita fine de la 19a 
      jarcento kaj ofte figurata en vakerfilmoj:
      <ekz>
        lia nevo estas kolektanto de modelaj fusiloj, kaj li ser&ccirc;as 
        iun modelon de <tld lit="V"/>o
        <fnt>
          <aut>Aoyama T.</aut>,
          <vrk><url
          ref="http://homepage1.nifty.com/aoyama-t/fusilo.htm">
          La Ser&ccirc;ado de Vincxestro</url></vrk>,
          <lok>2002-05-27</lok>
        </fnt>;
      </ekz>
      <ekz>
        kun korka kasko sur la kapo kaj <tld/>o en la mano li tretas 
        per la piedo rinoceron
        <fnt>
          <aut>S. Lem, trad. K. Du&scirc;enko, trad. J. Finkel</aut>,
          <vrk><url ref="http://www.esperanto.mv.ru/Lem/index.html">
          Surloka esploro</url></vrk>,
          <lok>2003</lok>
        </fnt>.
      </ekz>
    </dif>
  </snc>
  <trd lng="ca"><klr>[fusell]</klr> Winchester</trd>
  <trd lng="fr">winchester</trd>
  <trd lng="hu">winchester</trd>
</drv>
</art>

<!--
$Log: vincxestr.xml,v $
Revision 1.3  2012/08/13 10:10:21  revo
Marc Rausell: + trd ca

Revision 1.2  2008/07/16 16:31:05  revo
Jozefo Horvath: +trd hu

Revision 1.1  2007/05/19 17:02:55  revo
Jeromo Vasxe: nova artikolo

-->
</vortaro>
