<?xml version="1.0"?>
<!DOCTYPE vortaro SYSTEM "../dtd/vokoxml.dtd">

<vortaro>
<art mrk="$Id: alial.xml,v 1.5 2015/07/04 08:37:30 revo Exp $">
<kap>
    <rad>alial</rad>
</kap>
<drv mrk="alial.0">
  <kap><tld/></kap>
  <snc>
    <uzo tip="fak">GRA</uzo>
    <uzo tip="stl">EVI</uzo>
    <dif>
    =<ref tip="dif" cel="ali.0a.diferenca">ali</ref>ka&ubreve;ze.
    </dif>
    <rim>
    Tiu neoficiala malofta vorto ne apartenas al la <ref tip="dif"
    cel="tabel.0vorto">tabelvortoj</ref> kaj ties uzo kunportus
    drastajn &scirc;an&gcirc;ojn en la lingvon.
    </rim>
  </snc>
  <trd lng="cs">z jiného důvodu</trd>
  <trd lng="sk">z iného dôvodu</trd>
</drv>
</art>

<!--
$Log: alial.xml,v $
Revision 1.5  2015/07/04 08:37:30  revo
aldono de trd cs per skripto de M. von Laer

Revision 1.4  2015/06/28 12:03:35  revo
aldono de trd sk per skripto de M. von Laer

Revision 1.3  2014/02/06 16:10:13  revo
Damien Brucker: +ref

Revision 1.2  2014/02/06 14:10:13  revo
Damien Brucker: +rim

Revision 1.1  2014/02/06 13:10:15  revo
Damien Brucker: nova artikolo

-->
</vortaro>
