<?xml version="1.0"?>
<!DOCTYPE vortaro SYSTEM "../dtd/vokoxml.dtd">

<vortaro>
<art mrk="$Id: gnetac.xml,v 1.12 2013/08/25 16:11:32 revo Exp $">
<kap>
  <rad>gnetac</rad>/oj
</kap>

<drv mrk="gnetac.0oj">
  <kap>
    <tld/>oj
  </kap>
  <uzo tip="fak">BOT</uzo>
  <snc>
    <dif>
      <ref tip="lst" cel="famili.0o.BIO"
      lst="voko:botanikaj_familioj">Familio</ref> de <ref tip="malprt"
      cel="gnet.0oplantoj">gnetoplantoj</ref>
      (<trd lng="la">Gnetaceae</trd>).
    </dif>
  </snc>
  <trd lng="ca">gnet&agrave;cies</trd>
  <trd lng="de">Gnetaceae</trd>
  <trd lng="fr">gn&eacute;tac&eacute;es</trd>
  <trd lng="hu">gn&eacute;tumf&eacute;l&eacute;k</trd>
  <trd lng="nl">gnetacee&euml;n</trd>
  <trd lng="pt">gnet&aacute;ceas</trd>
  <trdgrp lng="ru">
    <trd>&c_g;&c_n;&c_je;&c_t;&c_o;&c_v;&c_y;&c_je;<klr tip="ind"> (&c_s;&c_je;&c_m;&c_je;&c_j;&c_s;&c_t;&c_v;&c_o;)</klr></trd>,
    <trd>&c_h;&c_v;&c_o;&c_j;&c_n;&c_i;&c_k;&c_o;&c_v;&c_y;&c_je; <klr tip="amb">(&c_s;&c_je;&c_m;&c_je;&c_j;&c_s;&c_t;&c_v;&c_o;)</klr></trd>
  </trdgrp>
</drv>
</art>
<!--
$Log: gnetac.xml,v $
Revision 1.12  2013/08/25 16:11:32  revo
Wolfram Diestel: referenco al listo bot familioj

Revision 1.11  2011/12/05 14:10:16  revo
Marc Rausell: kataluna traduko

Revision 1.10  2007/07/03 16:30:23  revo
Wieland Pusch: +trd de

Revision 1.9  2007/04/29 16:31:50  revo
Tulio Flores: +tr pt

Revision 1.8  2003/11/18 17:31:02  revo
Jozefo Horvath: +trd hu

Revision 1.7  2002/03/13 17:35:55  revo
Yury Finkel: kor trd ru

Revision 1.6  2002/01/11 17:33:16  revo
Paul Peeraerts: kor de tajperaro

Revision 1.5  2002/01/10 17:31:43  revo
-->
</vortaro>
