<?xml version="1.0"?>
<!DOCTYPE vortaro SYSTEM "../dtd/vokoxml.dtd">

<vortaro>
<art mrk="$Id: intim.xml,v 1.21 2015/12/30 21:10:16 revo Exp $">
<kap>
  <ofc>*</ofc>
  <rad>intim</rad>/a <fnt><bib>PV</bib></fnt>
</kap>
<drv mrk="intim.0a">
  <kap><ofc>*</ofc><tld/>a</kap>
  <snc mrk="intim.0a.sento">
    <dif>
      Karakterizata per profunde komunaj sentoj kaj plena konfido kaj
      sen&gcirc;eneco:
      <ekz>
        <tld/>a amiko;
      </ekz>
      <ekz>
        vivi kun iu en <tld/>a amikeco
        <fnt><bib>PrV</bib></fnt>
      </ekz>
      <ekz>
        <tld/>aj interrilatoj;
      </ekz>
      <ekz>
        <tld/>a interparolado;
      </ekz>
      <ekz>
        <uzo tip="stl">FIG</uzo>
        Esperanto estas al li same <tld/>a <klr>(malfremda,
        sen&gcirc;ene uzata)</klr> kiel la gepatra lingvo.
      </ekz>
    </dif>
    <refgrp tip="vid">
      <ref cel="famili1.0a">familiara</ref>,
      <ref cel="hejm.0eca">hejmeca</ref>.
    </refgrp>
    <trdgrp lng="de">
      <trd>intim</trd>,
      <trd>vertraut</trd>,
      <trd>innig</trd>
    </trdgrp>
    <trdgrp lng="hu">
      <trd>intim</trd>,
      <trd>bens&odblac;s&eacute;ges</trd>,
      <trd>meghitt</trd>
    </trdgrp>
    <trd lng="nl">intiem</trd>
    <trd lng="pt">familiar</trd>
    <trdgrp lng="ru">
      <trd>&c_i;&c_n;&c_t;&c_i;&c_m;&c_n;&c_y;&c_j;</trd>,
      <trd>&c_b;&c_l;&c_i;&c_z;&c_k;&c_i;&c_j;</trd>,
      <trd>&c_z;&c_a;&c_d;&c_u;&c_sh;&c_je;&c_v;&c_n;&c_y;&c_j;</trd>
    </trdgrp>
  </snc>
  <snc mrk="intim.0a.nepublika">
    <dif>
      Ekzistanta tute interne; ne aperanta ekstere; nepublika:
      <ekz>
        <tld/>aj sentoj, konvinkoj;
      </ekz>
      <ekz>
        la <tld/>a vivo;
      </ekz>
      <ekz>
        <tld/>aj aferoj;
      </ekz>
      <ekz>
        <tld/>a <klr>(senceremonia)</klr> vizito, festo.
      </ekz>
    </dif>
    <trdgrp lng="de">
      <trd>intim</trd>,
      <trd>privat</trd>
    </trdgrp>
    <trd lng="hu">bens&odblac;</trd>
    <trdgrp lng="pt">
     <trd>&iacute;ntimo</trd>, 
     <trd>particular</trd> 
    </trdgrp>
    <trdgrp lng="ru">
      <trd>&c_i;&c_n;&c_t;&c_i;&c_m;&c_n;&c_y;&c_j;</trd>,
      <trd>&c_l;&c_i;&c_ch;&c_n;&c_y;&c_j;</trd>,
      <trd>&c_p;&c_r;&c_i;&c_v;&c_a;&c_t;&c_n;&c_y;&c_j;</trd>
    </trdgrp>
  </snc>
  <trdgrp lng="cs">
    <trd>d&uring;v&ecaron;rn&yacute;</trd>,
    <trd>d&uring;v&ecaron;rn&yacute;</trd>,
    <trd>intimn&iacute;</trd>,
    <trd>&uacute;tuln&yacute;</trd>
  </trdgrp>
  <trd lng="es">&iacute;ntimo</trd>
  <trdgrp lng="fr">
    <trd>intime<klr tip="ind"> (adj.)</klr></trd>,
    <trd>priv&eacute;<klr tip="ind"> (intime)</klr></trd>,
    <trd>secret<klr tip="ind"> (intime)</klr></trd>,
    <trd>profond<klr tip="ind"> (intime)</klr></trd>
  </trdgrp>
  <trdgrp lng="id">
    <trd>akrab</trd>,
    <trd>intim</trd>
  </trdgrp>
  <trdgrp lng="sk">
    <trd>d&ocirc;vern&yacute;</trd>,
    <trd>int&iacute;mny</trd>,
    <trd>&uacute;zky <klr>(vz&tcaron;ah)</klr></trd>
  </trdgrp>
</drv>

<drv mrk="intim.0eco">
  <kap><tld/>eco</kap>
  <snc mrk="intim.0eco.KOMUNE">
    <dif>
      Eco de io <tld/>a:
      <ekz>
        vivi en granda <tld/>eco kun iu;
      </ekz>
      <ekz>
        <tld/>ece briletis la teleretoj<fnt>Z</fnt>.
      </ekz>
    </dif>
  </snc>
  <trdgrp lng="cs">
    <trd>intimita</trd>,
    <trd>intimnost</trd>
  </trdgrp>
  <trdgrp lng="de">
    <trd>Intimit&auml;t</trd>,
    <trd>Vertrautheit</trd>,
    <trd>Innigkeit</trd>
  </trdgrp>
  <trd lng="es">intimidad</trd>
  <trd lng="fr">intimit&eacute;</trd>
  <trdgrp lng="hu">
    <trd>intimit&aacute;s</trd>,
    <trd>bens&odblac;s&eacute;gess&eacute;g</trd>,
    <trd>meghitts&eacute;g</trd>
  </trdgrp>
  <trd lng="nl">intimiteit</trd>
  <trd lng="pt">intimidade</trd>
  <trdgrp lng="ru">
    <trd>&c_i;&c_n;&c_t;&c_i;&c_m;&c_n;&c_o;&c_s;&c_t;&c_mol;</trd>,
    <trd>&c_b;&c_l;&c_i;&c_z;&c_o;&c_s;&c_t;&c_mol;</trd>,
    <trd>&c_z;&c_a;&c_d;&c_u;&c_sh;&c_je;&c_v;&c_n;&c_o;&c_s;&c_t;&c_mol;</trd>,
    <trd>&c_s;&c_je;&c_r;&c_d;&c_je;&c_ch;&c_n;&c_o;&c_s;&c_t;&c_mol;</trd>
  </trdgrp>
  <trd lng="sk">d&ocirc;vernos&tcaron;</trd>
</drv>

<drv mrk="intim.0ismo">
  <kap><tld/>ismo</kap>
  <snc mrk="intim.0ismo.BELA">
    <uzo tip="fak">BELA</uzo>
    <uzo tip="fak">BELE</uzo>
    <dif>
      Prefero por temoj kaj esprimoj <tld/>aj,
      mal<ref tip="ant" cel="patos.0o.BELA">patosaj</ref>:
      <ekz>
        lirikaj esprimoj <tld/>ismaj <klr>...</klr> fluas serene kaj 
        simple kiel klara akvo el fonto
        <fnt>
          <aut>A. M. Botella</aut>,
          <vrk><url
          ref="https://sites.google.com/site/zaragozafrateco/antonio-marco/beletraj-pagoj/antonio-machado">
          La poeto de la intimismaj kolokvoj</url></vrk>,
          <lok>2000</lok>
        </fnt>.
      </ekz>
    </dif>
    <trd lng="fr">intimisme</trd>
  </snc>
</drv>

<drv mrk="intim.0ulo">
  <kap><tld/>ulo</kap>
  <snc mrk="intim.0ulo.KOMUNE">
    <dif>
      Persono, alligata al alia per reciprokaj sentoj kaj plena
      <ref cel="konfid.0o">konfido</ref>.
    </dif>
    <refgrp tip="vid">
      <ref cel="konfid1">konfidenculo</ref>.
    </refgrp>
  </snc>
  <trd lng="cs">d&uring;v&ecaron;rn&iacute;k</trd>
  <trdgrp lng="de">
    <trd>Intimus</trd>,
    <trd>Vertraute</trd>,
    <trd>Vertrauter</trd>
  </trdgrp>
  <trd lng="es">amigo <ind>&iacute;ntimo</ind></trd>
  <trdgrp lng="fr">
    <trd>intime<klr tip="ind"> (subst.)</klr></trd>,
    <trd>proche<klr tip="ind"> (subst.)</klr></trd>
  </trdgrp>
  <trdgrp lng="hu">
    <trd>meghitt bar&aacute;t</trd>,
    <trd>bizalmas<klr tip="amb">(a vkinek)</klr></trd>
  </trdgrp>
  <trd lng="nl">intieme vriend</trd>
  <trd lng="pt">pessoa <ind>&iacute;ntima</ind></trd>
  <trd lng="sk">d&ocirc;vern&iacute;k</trd>
</drv>

<drv mrk="intim.mal0a">
  <kap>mal<tld/>a</kap>
  <snc mrk="intim.mal0a.KOMUNE">
    <dif>
      Ekstere videbla, publika,
      <ref tip="vid" cel="fremd.0a.aliula">fremda<sncref/></ref>:
      <ekz>
        la &ccirc;ambro &scirc;ajnis vasta, kruda kaj mal<tld/>a
        <fnt>
          <aut>Hasegawa T.</aut>,
          <vrk><url
          ref="http://wikilivres.ca/wiki/En_%C4%88inio_Batalanta">
          En &Ccirc;inio Batalanta</url></vrk>, 
          <lok>1954</lok>
        </fnt>.
      </ekz>
    </dif>
  </snc>
  <trd lng="fr">impersonnel</trd>
  <trd lng="id">impersonal</trd>
</drv>
</art>
<!--
$Log: intim.xml,v $
Revision 1.21  2015/12/30 21:10:16  revo
Jeromo Vasxe: + ~ismo

Revision 1.20  2015/07/04 08:37:36  revo
aldono de trd cs per skripto de M. von Laer

Revision 1.19  2015/06/29 16:33:16  revo
aldono de trd sk per skripto de M. von Laer

Revision 1.18  2014/06/03 15:10:25  revo
Eko Nur Syah Hidayat: +id

Revision 1.17  2012/09/19 08:10:12  revo
Jeromo Vasxe: + mal~a

Revision 1.16  2010/04/01 16:30:28  revo
Bart Demeyere: +mrkoj

Revision 1.15  2005/12/05 17:31:23  revo
Luiz Portella: +trd pt

Revision 1.14  2004/09/06 16:36:36  revo
-->
</vortaro>
