<?xml version="1.0"?>
<!DOCTYPE vortaro SYSTEM "../dtd/vokoxml.dtd">

<vortaro>
<art mrk="$Id: bragx.xml,v 1.14 2009/03/24 17:30:29 revo Exp $">
<kap>
  <rad>bra&gcirc;</rad>/o
</kap>

<drv mrk="bragx.0o">
  <kap><tld/>o</kap>
  <snc>
    <dif>
      Ardaj ligno- a&ubreve; karbopecoj, jam duone konsumitaj kaj ne
      plu &jcirc;etantaj flamon:
      <ekz>
        fajrobrigadistoj alvenas kiam &ccirc;io forbrulis,
        &gcirc;ustatempe por
        observi la subcindrajn <tld/>ojn<fnt><aut>Hamza
        Baksi&cacute;</aut>:
        <vrk>La fino de la mondo komenci&gcirc;as en Sarajevo</vrk>,
        <bib>Monato</bib><lok>jaro 1993a, numero 10a, p. 8a</lok></fnt>.
      </ekz>
    </dif>
    <refgrp tip="sin">
      <ref cel="karb.0eto">karbeto</ref>,
      <ref cel="ard.karb0ajxo">karbarda&jcirc;o</ref>.
    </refgrp>
    <trd lng="de">Glut</trd>
    <trd lng="fr">braise</trd>
    <trd lng="hu">par&aacute;zs</trd>
    <trd lng="pl">w&eogonek;gle</trd>
    <trdgrp lng="ru">
      <trd>&c_r;&c_a;&c_s;&c_k;&c_a;&c_l;&c_jo;&c_n;&c_n;&c_y;&c_je;
      &c_u;&c_g;&c_l;&c_i;</trd>,
      <trd>&c_zh;&c_a;&c_r;</trd>
    </trdgrp>
  </snc>
  <snc>
    <dif>
      Tiaj samaj pecoj, estingitaj anta&ubreve; plena konsumi&gcirc;o
      kaj
      uzataj kiel <ref tip="super"
      cel="brul.0igajxo">bruliga&jcirc;o</ref>.
    </dif>
    <refgrp tip="sin">
      <ref cel="karb.0eto">karbeto</ref>,
      <ref cel="karb.ligno0o">lignokarbo</ref>.
    </refgrp>
    <trd lng="de">Holzkohle</trd>
    <trdgrp lng="fr">
      <trd>charbon de bois</trd>
    </trdgrp>
    <trd lng="hu">fasz&eacute;n</trd>    
    <trd lng="pl">w&eogonek;giel drzewny</trd>
    <trdgrp lng="ru">
      <trd>&c_u;&c_g;&c_l;&c_i;</trd>,
      <trd>&c_g;&c_o;&c_l;&c_o;&c_v;&c_je;&c_sh;&c_k;&c_i;</trd>
    </trdgrp>
  </snc>
  <trdgrp lng="be">
    <trd>&c_v;&c_u;&c_g;&c_a;&c_l;&c_mol;</trd>,
    <trd>&c_v;&c_u;&c_g;&c_o;&c_l;&c_mol;&c_l;&c_je;</trd>,
    <trd>&c_g;&c_a;&c_l;&c_a;&c_v;&c_je;&c_sh;&c_k;&c_ib;</trd>,
    <trd>&c_zh;&c_a;&c_r;</trd>
  </trdgrp>
  <trd lng="es">brasa</trd>
</drv>

<drv mrk="bragx.0ujo">
  <kap><tld/>ujo</kap>
  <snc>
    <dif>
      Metala a&jcirc;ura <ref tip="super" cel="fajr.0ujo">fajrujo</ref>,
      ofte portebla kaj metita sur piedo, uzata por teni ardajn
      <tld/>ojn
      kaj servi kiel <ref tip="super" cel="hejt">hejtilo</ref>.
    </dif>
  </snc>
  <trdgrp lng="be">
    <trd>&c_a;&c_ch;&c_a;&c_g;</trd>,
    <trd>&c_zh;&c_a;&c_r;&c_o;&c_w;&c_n;&c_ja;</trd>
  </trdgrp>
  <trd lng="de">Brasero</trd>
  <trd lng="es">brasero</trd>
  <trd lng="fr">brasero</trd>
  <trdgrp lng="hu">
    <trd>par&aacute;zs&uuml;st</trd>,
    <trd>mang&aacute;l</trd>
  </trdgrp>
  <trdgrp lng="ru">
    <trd>&c_o;&c_ch;&c_a;&c_g;</trd>,
    <trd>&c_zh;&c_a;&c_r;&c_o;&c_v;&c_n;&c_ja;</trd>
  </trdgrp>
</drv>
</art>
<!--
$Log: bragx.xml,v $
Revision 1.14  2009/03/24 17:30:29  revo
Sebastian Cyprych: +trd pl

Revision 1.13  2007/06/14 16:31:32  revo
Wieland Pusch: +trd de

Revision 1.12  2005/07/28 19:54:02  revo
Jozefo Horvath: +trd hu

Revision 1.11  2005/06/27 19:21:02  revo
Yury Finkel: +trd ru, -adm

Revision 1.10  2004/11/16 17:31:34  revo
Zmicier Lapcionak: + trd be

Revision 1.9  2002/10/02 07:34:09  revo
Jeromo Vasxe: + ekz, + 1 trd fr

Revision 1.8 2002/05/17 16:32:29 revo
Alejandro Mejia Greene: ald 2 his trd

Revision 1.7 2002/03/20 17:34:54 revo
-->
</vortaro>
