<?xml version="1.0"?>
<!DOCTYPE vortaro SYSTEM "../dtd/vokoxml.dtd">

<vortaro>
<art mrk="$Id: gxinz.xml,v 1.15 2015/01/29 04:10:52 revo Exp $">
<kap>
  <rad>&gcirc;inz</rad>/o
</kap>
<drv mrk="gxinz.0o">
  <kap><tld/>o</kap>
  <uzo tip="fak">TEKS</uzo>
  <snc mrk="gxinz.0o.TEKS">
    <dif>
      <ref tip="super" cel="pantal.0o">Pantalono</ref>
      de okcident-usona origino, el
      <ref tip="prt" cel="drelik.0o">dreliko</ref>, ofte blua:
      <ekz>
        sur la planko ku&scirc;is malnovaj gazetoj kaj kovertoj, sur
        la ununura se&gcirc;o ies <tld/>o, &scirc;trumpetoj, mamzono
        <fnt>
        <aut>Saliko</aut>, <vrk>En fremda lando</vrk>. <bib>Monato</bib>
        </fnt>;
      </ekz>
      <ekz>
        li portis nur grizan someran jakon kaj <tld/>on
        <fnt>
        <aut>PEJNO Simono</aut>, <vrk>La profeta kurso</vrk>.
        <bib>Monato</bib>
        </fnt>.
      </ekz>
    </dif>
  </snc>
  <trd lng="be">&c_d;&c_zh;&c_y;&c_n;&c_s;&c_y;</trd>
  <trdgrp lng="bg">
    <trd>&c_d;&c_malmol;&c_n;&c_k;&c_i;</trd>,
    <trd>&c_d;&c_zh;&c_i;&c_n;&c_s;&c_i;</trd>
  </trdgrp>
  <trdgrp lng="de">
    <trd>Jeans</trd>,
    <trd>Nietenhose</trd>
  </trdgrp>
  <trd lng="cs">d&zcaron;in(s)y</trd>
  <trd lng="en">jeans</trd>
  <trdgrp lng="es">
    <trd>(pantalones) <ind>vaqueros</ind></trd>,
    <trd>jeans</trd>,
    <trd>pantal&oacute;n de <ind>mezclilla</ind></trd>
  </trdgrp>
  <trd lng="hu">farmernadr&aacute;g</trd>
  <trdgrp lng="id">
    <trd>jeans</trd>,
    <trd>jins</trd>
  </trdgrp>
  <trd lng="it">blue-jeans</trd>
  <trd lng="fr">jeans</trd>
  <trd lng="nl">jeans</trd>
  <trd lng="pl">d&zdot;insy</trd>
  <trd lng="pt">jeans</trd>
  <trd lng="ru">&c_d;&c_zh;&c_i;&c_n;&c_s;&c_y;</trd>
</drv>
</art>
<!--
$Log: gxinz.xml,v $
Revision 1.15  2015/01/29 04:10:52  revo
Eko Nur Syah Hidayat: +trd id

Revision 1.14  2011/09/17 22:10:10  revo
Wieland Pusch: +trd bg

Revision 1.13  2005/12/24 17:31:02  revo
Jeromo Vasxe: + mrk

Revision 1.12 2005/12/12 17:31:21 revo
Sergio Pokrovskij: +ekz

Revision 1.11 2004/01/10 17:32:12 revo
Dmitri Gabinski: +trd be

Revision 1.10 2003/07/13 16:31:38 revo
Sergio Pokrovskij: +trd=cs,pl

Revision 1.9 2003/01/25 17:31:15 revo
Marco Trevisan Herraz: +trd it, alia trd hi

Revision 1.8 2002/07/09 17:35:03 revo
-->
</vortaro>
