<?xml version="1.0"?>
<!DOCTYPE vortaro SYSTEM "../dtd/vokoxml.dtd">

<vortaro>
<art mrk="$Id: neuxrodegener.xml,v 1.1 2014/05/01 08:10:28 revo Exp $">
<kap>
  <rad>ne&ubreve;rodegener</rad>/o
</kap>
<drv mrk="neuxrodegener.0o">
  <kap><tld/>o</kap>
  <snc mrk="neuxrodegener.0o.MED">
    <uzo tip="fak">MED</uzo>
    <dif>
      Malboni&gcirc;o de funkciado de la nervosistemo
      pro degenero de ne&ubreve;ronoj, ka&ubreve;zanta diversajn
      malsanojn:
      <ekz>
        <tld/>a malsano <ctl>Morbus Huntington</ctl>
        <fnt>
          <aut>A. Oberndorfer</aut>,
          <vrk><url
          ref="http://esperantaretradio.blogspot.com/2014/04/grava-molekulo-por-purigado-de-celoj.html">
          Grava molekulo por purigado de &ccirc;eloj</url></vrk>,
          <lok>Esperanta Retradio, 2014-04-07</lok>
        </fnt>.
      </ekz>
    </dif>
  </snc>
  <trd lng="en">neurodegeneration</trd>
  <trd lng="fr">neurod&eacute;g&eacute;n&eacute;rescence</trd>
</drv>
</art>

<!--
$Log: neuxrodegener.xml,v $
Revision 1.1  2014/05/01 08:10:28  revo
Jeromo Vasxe: nova artikolo

-->
</vortaro>