<?xml version="1.0"?>
<!DOCTYPE vortaro SYSTEM "../dtd/vokoxml.dtd">

<vortaro>
<art mrk="$Id: vermicxel.xml,v 1.9 2013/08/01 09:10:10 revo Exp $">
<kap>
  <ofc>*</ofc>
  <rad>vermi&ccirc;el</rad>/o <fnt><bib>PV</bib></fnt>
</kap>
<drv mrk="vermicxel.0o">
  <kap><ofc>*</ofc><tld/>o</kap>
  <uzo tip="fak">KUI</uzo>
  <snc mrk="vermicxel.0o.vermforma">
    <dif>
      Fadenforma <ref tip="super" cel="nudel.0o">nudelo</ref>:
      <ekz>
        &ccirc;iu el ni man&gcirc;is tason da fritita <tld/>o
        <fnt>
          <aut>Hasegawa T.</aut>,
          <vrk><url
          ref="http://wikilivres.ca/wiki/En_%C4%88inio_Batalanta">
          En &Ccirc;inio Batalanta</url></vrk>, 
          <lok>1954</lok>
        </fnt>.
      </ekz>
    </dif>
    <trd lng="hu">c&eacute;rnamet&eacute;lt</trd>
    <trd lng="ru">&c_v;&c_je;&c_r;&c_m;&c_i;&c_sh;&c_je;&c_l;&c_mol;</trd>
  </snc>
  <snc mrk="vermicxel.0o.cxia">
    <dif>
      &Ccirc;ia <ref tip="sin" cel="nudel.0o.cxia">nudelo</ref>,
      <ref tip="sin" cel="past.0ajxo.nudelo">pasta&jcirc;o</ref>
      preparata per bolkuirado.
    </dif>
    <rim mrk="vermicxel.0o.rimFund">
      El la tradukoj germanen, rusen kaj polen, kiujn donas UV,
      evidentas ke la intenco estis doni al la vorto la sencon
      &gcirc;eneralan (tiun de <tld/>o<sncref ref="vermicxel.0o.cxia"/>).
      Tamen la nunaj vortaroj &ccirc;i tiun fundamentan sencon e&ccirc;
      ne mencias.
    </rim>
    <trd lng="hu">met&eacute;lt <ind>t&eacute;szta</ind></trd>
    <trd lng="pl">makaron</trd>
    <trdgrp lng="ru">
      <trd>&c_m;&c_a;&c_k;&c_a;&c_r;&c_o;&c_n;&c_n;&c_o;&c_je; &c_i;&c_z;&c_d;&c_je;&c_l;&c_i;&c_je;</trd>,
      <trd>&c_l;&c_a;&c_p;&c_sh;&c_a;</trd>
    </trdgrp>
  </snc>
  <rim mrk="vermicxel.0o.nombro">
    En la PIV-oj la vorto indikas unuopan peceton de la pasta&jcirc;o,
    en UV la vorto havas sencon aran.
  </rim>
  <trd lng="be">&c_v;&c_e;&c_r;&c_m;&c_ib;&c_sh;&c_e;&c_l;&c_mol;</trd>
  <trd lng="bg">&c_f;&c_i;&c_d;&c_je;</trd>
  <trd lng="ca">fideu</trd>
  <trd lng="de">Fadennudeln</trd>
  <trd lng="es">fideo</trd>
  <trd lng="fr">vermicelle</trd>
  <trd lng="en">vermicelli</trd>
  <trd lng="nl">vermicelli</trd>
  <trdgrp lng="pt">
   <trd>aletria</trd>,
   <trd>letria</trd>,
   <trd>cabelo-de-anjo</trd>,
   <trd>fidelinho</trd>,
   <trd>fid&eacute;u</trd>
  </trdgrp>
</drv>
</art>
<!--
$Log: vermicxel.xml,v $
Revision 1.9  2013/08/01 09:10:10  revo
Joop Eggen: +trd bg

Revision 1.8  2012/09/19 10:10:08  revo
Jeromo Vasxe: + ekz

Revision 1.7  2012/08/12 10:10:18  revo
Marc Rausell: + trd ca

Revision 1.6  2008/07/16 16:30:54  revo
Jozefo Horvath: +trd hu

Revision 1.5  2006/02/02 17:31:40  revo
Tulio Flores: +trd pt

Revision 1.4  2005/12/17 17:31:30  revo
Jeromo Vasxe: kor 1 mrk

Revision 1.3 2005/12/06 17:33:29 revo
Raul Salinas Monteagudo: +trd es

Revision 1.2 2004/06/08 21:25:08 revo
-->
</vortaro>
