<?xml version="1.0"?>
<!DOCTYPE vortaro SYSTEM "../dtd/vokoxml.dtd">

<vortaro>
<art mrk="$Id: anticiklon.xml,v 1.3 2015/07/04 08:37:30 revo Exp $">
<kap>
  <rad>anticiklon</rad>/o <fnt><bib>PIV1</bib></fnt>
</kap>
<drv mrk="anticiklon.0o">
  <kap><tld/>o</kap>
  <snc mrk="anticiklon.0o.MET">
    <uzo tip="fak">MET</uzo>
    <ref tip="dif" cel="ciklon.kontraux0o.MET">kontra&ubreve;ciklono</ref>
    <ekz>
      somere la <tld/>o alportas varmegan, preska&ubreve; sennuban
      veteron; vintre &gcirc;i karakterizi&gcirc;as per frosta vetero
      kaj nebuloj
      <fnt>
        <aut>E. Alvim de Oliveira</aut>,
        <vrk>Meteologio: bazaj principoj pri vetero kaj klimato</vrk>,
        <lok>en: 4a Kongreso de Esperanto de &Scirc;tato San-Pa&ubreve;lo, 2009</lok>
      </fnt>.
      </ekz>
  </snc>
  <trdgrp lng="cs">
    <trd>anticyklona</trd>,
    <trd>tlaková výše</trd>
  </trdgrp>
  <trd lng="fr">anticyclone</trd>
  <trd lng="sk">anticyklón</trd>
</drv>
</art>

<!--
$Log: anticiklon.xml,v $
Revision 1.3  2015/07/04 08:37:30  revo
aldono de trd cs per skripto de M. von Laer

Revision 1.2  2015/06/28 12:03:35  revo
aldono de trd sk per skripto de M. von Laer

Revision 1.1  2012/04/23 09:10:11  revo
Jeromo Vasxe: nova artikolo

-->
</vortaro>