<?xml version="1.0"?>
<!DOCTYPE vortaro SYSTEM "../dtd/vokoxml.dtd">

<vortaro>
<art mrk="$Id: pug.xml,v 1.17 2015/07/04 08:37:42 revo Exp $">
<kap>
  <rad>pug</rad>/o
</kap>
<drv mrk="pug.0o">
  <kap><tld/>o</kap>
  <snc>
    <dif>
      La du <ref tip="prt" cel="vang.sid0o">sidvangoj</ref> &ccirc;e homo:
      <ekz>
        la <ind>bel<tld/>a</ind> Afrodita <klr>(fama helena
        statuo)</klr>;
        <trd lng="fr">callipyge</trd>
      </ekz>
      <ekz>
        <ind><tld/>mezuro</ind> <klr>(por al&gcirc;ustigo de jupo a&ubreve;
        de pantalono)</klr>;
        <trd lng="fr">tour de hanches</trd>
      </ekz>
      <ekz>
        unu supra&jcirc;a rigardo sur lian viza&gcirc;on sufi&ccirc;as
        por kompreni, ke li estas malnobla, &ccirc;ikanema, senprincipa,
        <ind><tld/>olekema</ind> kanajlo <klr>(flatemulo)</klr>
        <fnt><bib>MkM</bib><lok>&ccirc;ap. 7</lok></fnt>.
        <trd lng="fr">l&egrave;che-cul<klr tip="ind"> (adj.)</klr></trd>
      </ekz>
    </dif>
    <ref tip="vid" cel="post.0ajxo.pugo">posta&jcirc;o</ref>
  </snc>
  <trd lng="be">&c_z;&c_a;&c_d;&c_n;&c_ib;&c_c;&c_a;</trd>
  <trd lng="bg">&c_d;&c_u;&c_p;&c_je;</trd>
  <trdgrp lng="cs">
    <trd>boky</trd>,
    <trd>zadek</trd>,
    <trd>zadnice</trd>,
    <trd>zvířecí řiť</trd>
  </trdgrp>
  <trdgrp lng="de">
    <trd>Hintern</trd>,
    <trd>Arsch</trd>,
    <trd>Popo</trd>,
    <trd>Po</trd>
  </trdgrp>
  <trdgrp lng="en">
    <trd>buttocks</trd>,
    <trd>rump</trd>,
    <trd>backside</trd>,
    <trd>cheeks</trd>,
    <trd>butt</trd>,
    <trd>ass</trd>
  </trdgrp>
  <trdgrp lng="es">
    <trd>trasero</trd>,
    <trd>nalgas</trd>,
    <trd>culo</trd>
  </trdgrp>
  <trdgrp lng="fr">
    <trd>derri&egrave;re<klr tip="ind"> (ana.)</klr></trd>,
    <trd>post&eacute;rieur<klr tip="ind"> (ana.)</klr></trd>,
    <trd>cul</trd>
  </trdgrp>
  <trdgrp lng="hu">
    <trd>far</trd>,
    <trd>h&aacute;ts&oacute;</trd>,
    <trd>fen&eacute;k</trd>
  </trdgrp>
  <trdgrp lng="it">
    <trd>sedere</trd>,
    <trd>culo</trd>,
    <trd>didietro</trd>
  </trdgrp>
  <trd lng="nl">achterwerk</trd>
  <trdgrp lng="pl">
    <trd>po&sacute;ladki</trd>,
    <trd>okolica <ind>po&sacute;ladkowa</ind></trd>,
    <trd>zad</trd>,
    <trd>zadek</trd>,
    <trd>ty&lstroke;ek</trd>,
    <trd>siedzenie</trd>,
    <trd>pupa <klr>(euf.)</klr></trd>,
    <trd>dupa <klr>(wulg.)</klr></trd>
  </trdgrp>
  <trdgrp lng="pt">
    <trd>n&aacute;degas</trd>,  
    <trd>bunda</trd>
  </trdgrp>
  <trd lng="ru">&c_z;&c_a;&c_d;&c_n;&c_i;&c_c;&c_a;</trd>
  <trd lng="sk">zadok</trd>
</drv>
</art>
<!--
$Log: pug.xml,v $
Revision 1.17  2015/07/04 08:37:42  revo
aldono de trd cs per skripto de M. von Laer

Revision 1.16  2015/06/29 16:40:19  revo
aldono de trd sk per skripto de M. von Laer

Revision 1.15  2013/07/10 15:10:08  revo
Joop Eggen: +trd bg

Revision 1.14  2010/01/18 17:31:58  revo
Russ Williams: +trd en

Revision 1.13  2009/03/06 17:30:47  revo
Marcus Curdeius: +pl

Revision 1.12  2006/04/17 16:32:27  revo
Tulio Flores: +tr pt

Revision 1.11  2004/02/22 17:32:13  revo
Marc Bavant: mod dif, +trd en ekz, +ekz kun ~olekema, mod ref tip al
postajxo, mod trd fr

Revision 1.10 2003/07/26 08:43:48 revo
Dmitri Gabinski: +trd be

Revision 1.9 2003/01/29 17:32:33 revo
Marco Trevisan Herraz: +trd it

-->
</vortaro>
