<?xml version="1.0"?>
<!DOCTYPE vortaro SYSTEM "../dtd/vokoxml.dtd">

<vortaro>
<art mrk="$Id: empiri2.xml,v 1.6 2014/11/26 13:10:23 revo Exp $">
  <kap>
    <rad>empirist</rad>/o
    <fnt>Z</fnt>
  </kap>
  <drv mrk="empiri2.0o">
  <kap><tld/>o</kap>
  <snc>
      <ref tip="dif" cel="empiri.0isto">empiriisto</ref>  
  </snc>
  <trd lng="be">&c_e;&c_m;&c_p;&c_ib;&c_r;&c_y;&c_k;</trd>
  <trd lng="fr">empiriste</trd>
  <trdgrp lng="ru">
    <trd>&c_e;&c_m;&c_p;&c_i;&c_r;&c_i;&c_k;</trd>,
    <trd>&c_p;&c_r;&c_a;&c_k;&c_t;&c_i;&c_k;</trd>
  </trdgrp>
  </drv>
</art>
<!--
$Log: empiri2.xml,v $
Revision 1.6  2014/11/26 13:10:23  revo
Damien Brucker: +trd fr

Revision 1.5  2003/12/17 17:31:08  revo
Dmitri Gabinski: +trd be

Revision 1.4  2001/04/11 16:21:15  revo
Yury Finkel: +trd ru

-->
</vortaro>
